{"appraisal":{"status":"none","timestamp":1700000017,"verifier":"https://bernstein.run/trace/verifier"},"build_provenance":{"digest":"sha256:0f773047eab6842fc8f06605a90dec9916ac85684e0975ee6c8d11354f58dd4d","provenance_uri":"https://github.com/sipyourdrink-ltd/bernstein/releases","slsa_level":0},"cnf":{"jwk":{"crv":"Ed25519","kid":"install-fixturefixture01","kty":"OKP","x":"gyClGXfYw4yopJJ8Zw31gh5El2GUXhXp77JqFQnSMOo"}},"data_class":"internal","delegation":{"credential_id":"trust-record-vector-delegation-credential","parent_record_hash":"sha256:8998683ec5389f524cf4a78c074671a29dd9cb5d94c13ee0f17cf27c53e88ba0"},"eat_profile":"tag:agentrust-io.com,2026:trace-v0.2","iat":1700000017,"model":{"model_id":"claude-haiku-5","provider":"anthropic"},"policy":{"bundle_hash":"sha256:5e0f69f155a0b6cc3c62828aa0fc3fe042d21d228081550e674842aa4c58e316","enforcement_mode":"enforce"},"runtime":{"measurement":"sha256:0000000000000000000000000000000000000000000000000000000000000000","platform":"software-only"},"signature":"Mu7jB7SaAehbt98i69il43IWlFROTduxqkHq4XocvgBri1D5oQ5t3NwrkMiS23pwEnNI5yFPDKqFSasF-4pkDg","subject":"spiffe://bernstein.run/run/trust-record-vector-run/exec/trust-record-vector-child","tool_transcript":{"call_count":0,"hash":"sha256:4f53cda18c2baa0c0354bb5f9a3ecbe5ed12ab4d8e11ba873c2f11161202b945"}}
