{"appraisal":{"status":"none","timestamp":1700000017,"verifier":"https://bernstein.run/trace/verifier"},"build_provenance":{"digest":"sha256:0f773047eab6842fc8f06605a90dec9916ac85684e0975ee6c8d11354f58dd4d","provenance_uri":"https://github.com/sipyourdrink-ltd/bernstein/releases","slsa_level":0},"cnf":{"jwk":{"crv":"Ed25519","kid":"install-fixturefixture01","kty":"OKP","x":"gyClGXfYw4yopJJ8Zw31gh5El2GUXhXp77JqFQnSMOo"}},"data_class":"internal","eat_profile":"tag:agentrust-io.com,2026:trace-v0.2","iat":1700000017,"model":{"model_id":"claude-haiku-5","provider":"anthropic"},"policy":{"bundle_hash":"sha256:d8714260188be82acb26251dcd5f7f9c927c6a2e6a733a92b9dc29519589504b","enforcement_mode":"enforce"},"references":[{"id":"sha256:61dc2465e0435c251d0b334ef0e77a2c349d1d789aa83cc4c225cca1f2408c57","rel":"member-execution","resolver":"https://bernstein.run/trace/records"},{"id":"sha256:d231119fde81369c160e5ef8c16b80a3691d36f6705f8bc1cda80b91aa50ca81","rel":"member-execution","resolver":"https://bernstein.run/trace/records"}],"runtime":{"measurement":"sha256:0000000000000000000000000000000000000000000000000000000000000000","platform":"software-only"},"signature":"g51eFMK51oYV0IksIkXZMrnWYt1G4798DwnnkQn8yaraH3hGdDTbl38JAjBq4MNoWZsrsQielSodo-1dhIvyAA","subject":"spiffe://bernstein.run/run/trust-record-vector-run","tool_transcript":{"call_count":0,"hash":"sha256:660b9b5b162582be710414595a696618922d1b65c9df54623c2a3840d644fbbb"}}
