{"appraisal":{"status":"none","timestamp":1700000022,"verifier":"https://bernstein.run/trace/verifier"},"build_provenance":{"digest":"sha256:0f773047eab6842fc8f06605a90dec9916ac85684e0975ee6c8d11354f58dd4d","provenance_uri":"https://github.com/sipyourdrink-ltd/bernstein/releases","slsa_level":0},"cnf":{"jwk":{"crv":"Ed25519","kid":"install-fixturefixture01","kty":"OKP","x":"gyClGXfYw4yopJJ8Zw31gh5El2GUXhXp77JqFQnSMOo"}},"data_class":"restricted","delegation":{"credential_id":"trust-record-vector-delegation-credential:scope=restricted","parent_record_hash":"sha256:d231119fde81369c160e5ef8c16b80a3691d36f6705f8bc1cda80b91aa50ca81"},"eat_profile":"tag:agentrust-io.com,2026:trace-v0.2","iat":1700000022,"model":{"model_id":"claude-haiku-5","provider":"anthropic"},"policy":{"bundle_hash":"sha256:78422e486a04ec0243181b5466aa34faa213754adc39c344ca96fe7bfb595232","enforcement_mode":"enforce"},"runtime":{"measurement":"sha256:0000000000000000000000000000000000000000000000000000000000000000","platform":"software-only"},"signature":"6hYSU26xGKtqX2aQj_SxFcVgC3FrcVyVmg4ygTBYLQlsqaDmc_qk_U1KpMoNmIALEZYf2ziN8-R5Gki1tb4ZAA","subject":"spiffe://bernstein.run/run/trust-record-vector-run/exec/trust-record-vector-grandchild","tool_transcript":{"call_count":0,"hash":"sha256:4f53cda18c2baa0c0354bb5f9a3ecbe5ed12ab4d8e11ba873c2f11161202b945"}}
