{"appraisal":{"status":"none","timestamp":1700000027,"verifier":"https://bernstein.run/trace/verifier"},"build_provenance":{"digest":"sha256:0f773047eab6842fc8f06605a90dec9916ac85684e0975ee6c8d11354f58dd4d","provenance_uri":"https://github.com/sipyourdrink-ltd/bernstein/releases","slsa_level":0},"cnf":{"jwk":{"crv":"Ed25519","kid":"install-fixturefixture01","kty":"OKP","x":"gyClGXfYw4yopJJ8Zw31gh5El2GUXhXp77JqFQnSMOo","\ue000":"bmp-private-use","\ud83d\ude00":"supplementary-plane"}},"data_class":"internal","eat_profile":"tag:agentrust-io.com,2026:trace-v0.2","iat":1700000027,"model":{"model_id":"claude-sonnet-5","provider":"anthropic"},"policy":{"bundle_hash":"sha256:edf4fe7003875c3467320a53aa03874670d21b4ed6d3c65b97ee8e5bdbe32b9f","enforcement_mode":"enforce"},"runtime":{"measurement":"sha256:0000000000000000000000000000000000000000000000000000000000000000","platform":"software-only"},"signature":"OjuC3I32m0k5k4eHe7KLH7pNosTWLB0L-mdlD6sX-ZbVYCIVpBANdSEzIJ6CKdhV2Y3VFjrpidp2Erctcb1DDA","subject":"spiffe://bernstein.run/run/trust-record-vector-supplementary-run/exec/trust-record-vector-supp-parent","tool_transcript":{"call_count":0,"hash":"sha256:4f53cda18c2baa0c0354bb5f9a3ecbe5ed12ab4d8e11ba873c2f11161202b945"}}
