{"appraisal":{"status":"none","timestamp":1700000032,"verifier":"https://bernstein.run/trace/verifier"},"build_provenance":{"digest":"sha256:0f773047eab6842fc8f06605a90dec9916ac85684e0975ee6c8d11354f58dd4d","provenance_uri":"https://github.com/sipyourdrink-ltd/bernstein/releases","slsa_level":0},"cnf":{"jwk":{"crv":"Ed25519","kid":"install-fixturefixture01","kty":"OKP","x":"gyClGXfYw4yopJJ8Zw31gh5El2GUXhXp77JqFQnSMOo"}},"data_class":"internal","delegation":{"credential_id":"trust-record-vector-delegation-credential:scope=narrow","parent_record_hash":"sha256:9ae1b732eac4b03e3d9cba08fa511e1928af4701371ccb1b4ba3be79dfae5293"},"eat_profile":"tag:agentrust-io.com,2026:trace-v0.2","iat":1700000032,"model":{"model_id":"claude-haiku-5","provider":"anthropic"},"policy":{"bundle_hash":"sha256:5e0f69f155a0b6cc3c62828aa0fc3fe042d21d228081550e674842aa4c58e316","enforcement_mode":"enforce"},"runtime":{"measurement":"sha256:0000000000000000000000000000000000000000000000000000000000000000","platform":"software-only"},"signature":"8bGK0mV886sfHSHW2qIrAhMOLc7RJdse6STgAlbiq0i0Ulft7JBkUxDQZ5bSLsgTPfdFJbr-AUNwkLXjT_g9Bw","subject":"spiffe://bernstein.run/run/trust-record-vector-supplementary-run/exec/trust-record-vector-supp-child","tool_transcript":{"call_count":0,"hash":"sha256:4f53cda18c2baa0c0354bb5f9a3ecbe5ed12ab4d8e11ba873c2f11161202b945"}}
